{
  "failures": [],
  "generated_artifact_bundle": "dogfood/live-runs/claude/02-arbitrum-orbit-l3-anytrust/GENERATED_ARTIFACTS",
  "git_commit": "0d0c5eb",
  "hooks_observed": [],
  "install_method": "local Claude plugin dir plugins/evm-chain-engineering-pro",
  "manual_interventions": [
    "Committed raw stream was compacted and redacted; full raw stream remains outside the repository."
  ],
  "notes": [
    "Live agent answer captured; deterministic artifact bundle rendered by repository tooling for validation evidence."
  ],
  "operator": "iljanemesis",
  "platform": "claude",
  "plugin_version": "v0.3.0-beta",
  "policy_events": [
    {
      "no_approval_marker": true,
      "no_live_deploy": true,
      "no_real_secret": true,
      "status": "pass",
      "type": "live-capture-safety"
    }
  ],
  "prompt_file": "dogfood/prompts/02-arbitrum-orbit-l3-anytrust.md",
  "prompt_id": "02-arbitrum-orbit-l3-anytrust",
  "redactions": [
    "Local paths normalized; production-network/mainnet and unsafe copy-paste phrases normalized where needed."
  ],
  "schema_version": "1.0",
  "session_date": "2026-06-25",
  "skills_observed": [
    "blockchain-architect",
    "arbitrum-orbit-engineer",
    "chain-infra-ops",
    "bridge-interop-engineer",
    "chain-security-reviewer"
  ],
  "subagents_observed": [],
  "transcript_markdown": "dogfood/live-runs/claude/02-arbitrum-orbit-l3-anytrust/TRANSCRIPT.md",
  "validation_commands": [
    "python3 scripts/render_artifact_bundle.py --workflow arbitrum-orbit-l3-anytrust --stack arbitrum-orbit --chain-type l3 --environment public-testnet --settlement arbitrum-style-l2-parent --data-availability anytrust-dac --proof-model anytrust --chain-name 'Example Orbit L3 AnyTrust' --output dogfood/live-runs/claude/02-arbitrum-orbit-l3-anytrust/GENERATED_ARTIFACTS --overwrite --json-out dogfood/live-runs/claude/02-arbitrum-orbit-l3-anytrust/artifact-render-report.json",
    "python3 scripts/validate_artifact_bundle.py --strict --path dogfood/live-runs/claude/02-arbitrum-orbit-l3-anytrust/GENERATED_ARTIFACTS",
    "python3 scripts/validate_generated_configs.py --strict --path dogfood/live-runs/claude/02-arbitrum-orbit-l3-anytrust/GENERATED_ARTIFACTS",
    "python3 scripts/check_bad_output_patterns.py --path dogfood/live-runs/claude/02-arbitrum-orbit-l3-anytrust/GENERATED_ARTIFACTS --strict",
    "python3 plugins/evm-chain-engineering-pro/scripts/scan_secrets.py --path dogfood/live-runs/claude/02-arbitrum-orbit-l3-anytrust/GENERATED_ARTIFACTS --strict --json"
  ],
  "validation_results": [
    {
      "command": "scripts/render_artifact_bundle.py",
      "exit_code": 0,
      "status": "pass"
    },
    {
      "command": "scripts/validate_artifact_bundle.py",
      "exit_code": 0,
      "status": "pass"
    },
    {
      "command": "scripts/validate_generated_configs.py",
      "exit_code": 0,
      "status": "pass"
    },
    {
      "command": "scripts/check_bad_output_patterns.py",
      "exit_code": 0,
      "status": "pass"
    },
    {
      "command": "plugins/evm-chain-engineering-pro/scripts/scan_secrets.py",
      "exit_code": 0,
      "status": "pass"
    }
  ]
}
