{
  "failures": [],
  "generated_artifact_bundle": null,
  "git_commit": "0d0c5eb",
  "hooks_observed": [],
  "install_method": "local Claude plugin dir plugins/evm-chain-engineering-pro",
  "manual_interventions": [
    "Committed raw stream was compacted and redacted; full raw stream remains outside the repository."
  ],
  "notes": [
    "Live agent answer captured; deterministic evidence rendered by repository tooling for validation.",
    "Prompt 07 is decision-only; supplemental GENERATED_ARTIFACTS is not a schema artifact bundle."
  ],
  "operator": "iljanemesis",
  "platform": "claude",
  "plugin_version": "v0.3.0-beta",
  "policy_events": [
    {
      "no_approval_marker": true,
      "no_live_deploy": true,
      "no_real_secret": true,
      "status": "pass",
      "type": "live-capture-safety"
    }
  ],
  "prompt_file": "dogfood/prompts/07-stack-selection-gaming-chain.md",
  "prompt_id": "07-stack-selection-gaming-chain",
  "redactions": [
    "Local paths normalized; production-network/mainnet and unsafe copy-paste phrases normalized where needed."
  ],
  "schema_version": "1.0",
  "session_date": "2026-06-25",
  "skills_observed": [
    "blockchain-architect",
    "chain-infra-ops",
    "bridge-interop-engineer",
    "chain-security-reviewer"
  ],
  "subagents_observed": [],
  "transcript_markdown": "dogfood/live-runs/claude/07-stack-selection-gaming-chain/TRANSCRIPT.md",
  "validation_commands": [
    "not-applicable-stack-selection"
  ],
  "validation_results": [
    {
      "command": "not-applicable-stack-selection",
      "exit_code": 0,
      "status": "pass"
    }
  ]
}
