{
  "failures": [],
  "generated_artifact_bundle": "dogfood/live-runs/claude/05-evm-l1-validator-network/GENERATED_ARTIFACTS",
  "git_commit": "0d0c5eb",
  "hooks_observed": [],
  "install_method": "local Claude plugin dir plugins/evm-chain-engineering-pro",
  "manual_interventions": [
    "Committed raw stream was compacted and redacted; full raw stream remains outside the repository."
  ],
  "notes": [
    "Live agent answer captured; deterministic evidence rendered by repository tooling for validation."
  ],
  "operator": "iljanemesis",
  "platform": "claude",
  "plugin_version": "v0.3.0-beta",
  "policy_events": [
    {
      "no_approval_marker": true,
      "no_live_deploy": true,
      "no_real_secret": true,
      "status": "pass",
      "type": "live-capture-safety"
    }
  ],
  "prompt_file": "dogfood/prompts/05-evm-l1-validator-network.md",
  "prompt_id": "05-evm-l1-validator-network",
  "redactions": [
    "Local paths normalized; production-network/mainnet and unsafe copy-paste phrases normalized where needed."
  ],
  "schema_version": "1.0",
  "session_date": "2026-06-25",
  "skills_observed": [
    "blockchain-architect",
    "evm-l1-builder",
    "chain-infra-ops",
    "chain-security-reviewer"
  ],
  "subagents_observed": [],
  "transcript_markdown": "dogfood/live-runs/claude/05-evm-l1-validator-network/TRANSCRIPT.md",
  "validation_commands": [
    "/usr/bin/python3 scripts/render_artifact_bundle.py --workflow evm-l1-posa-testnet --stack bnb-style-posa --chain-type l1 --environment public-testnet --settlement native-l1 --data-availability native-chain --proof-model validator-consensus --chain-name Example EVM L1 PoSA Testnet --output <REPO>/dogfood/live-runs/claude/05-evm-l1-validator-network/GENERATED_ARTIFACTS --overwrite --json-out <REPO>/dogfood/live-runs/claude/05-evm-l1-validator-network/artifact-render-report.json",
    "/usr/bin/python3 scripts/validate_artifact_bundle.py --strict --path <REPO>/dogfood/live-runs/claude/05-evm-l1-validator-network/GENERATED_ARTIFACTS --json-out <REPO>/dogfood/live-runs/claude/05-evm-l1-validator-network/GENERATED_ARTIFACTS/evidence/artifact-validation-report.json",
    "/usr/bin/python3 scripts/validate_generated_configs.py --strict --path <REPO>/dogfood/live-runs/claude/05-evm-l1-validator-network/GENERATED_ARTIFACTS --json-out <REPO>/dogfood/live-runs/claude/05-evm-l1-validator-network/GENERATED_ARTIFACTS/evidence/generated-config-validation-report.json",
    "/usr/bin/python3 scripts/check_bad_output_patterns.py --path <REPO>/dogfood/live-runs/claude/05-evm-l1-validator-network/GENERATED_ARTIFACTS --strict --json-out <REPO>/dogfood/live-runs/claude/05-evm-l1-validator-network/GENERATED_ARTIFACTS/evidence/bad-output-patterns-report.json",
    "/usr/bin/python3 plugins/evm-chain-engineering-pro/scripts/scan_secrets.py --path <REPO>/dogfood/live-runs/claude/05-evm-l1-validator-network/GENERATED_ARTIFACTS --strict --json"
  ],
  "validation_results": [
    {
      "command": "scripts/render_artifact_bundle.py",
      "exit_code": 0,
      "status": "pass"
    },
    {
      "command": "scripts/validate_artifact_bundle.py",
      "exit_code": 0,
      "status": "pass"
    },
    {
      "command": "scripts/validate_generated_configs.py",
      "exit_code": 0,
      "status": "pass"
    },
    {
      "command": "scripts/check_bad_output_patterns.py",
      "exit_code": 0,
      "status": "pass"
    },
    {
      "command": "plugins/evm-chain-engineering-pro/scripts/scan_secrets.py",
      "exit_code": 0,
      "status": "pass"
    }
  ]
}
