{
  "schema_version": "1.0",
  "platform": "claude",
  "plugin_version": "v0.3.0-beta",
  "git_commit": "52eb1ff",
  "prompt_id": "01-op-stack-public-testnet",
  "prompt_file": "dogfood/prompts/01-op-stack-public-testnet.md",
  "session_date": "2026-06-25",
  "operator": "iljanemesis",
  "install_method": "local Claude plugin-dir plugins/evm-chain-engineering-pro",
  "transcript_markdown": "dogfood/live-runs/claude/01-op-stack-public-testnet/TRANSCRIPT.md",
  "skills_observed": [
    "blockchain-architect",
    "op-stack-engineer",
    "chain-infra-ops",
    "chain-security-reviewer",
    "bridge-interop-engineer"
  ],
  "subagents_observed": [],
  "hooks_observed": [
    "PreToolUse:Bash"
  ],
  "generated_artifact_bundle": "dogfood/live-runs/claude/01-op-stack-public-testnet/GENERATED_ARTIFACTS",
  "validation_commands": [
    "claude plugin validate plugins/evm-chain-engineering-pro --strict",
    "claude --print --verbose --output-format stream-json --include-hook-events --plugin-dir plugins/evm-chain-engineering-pro --permission-mode acceptEdits --max-budget-usd 0.80 < dogfood/live-runs/claude/01-op-stack-public-testnet/PROMPT.md",
    "python3 scripts/validate_artifact_bundle.py --strict --path dogfood/live-runs/claude/01-op-stack-public-testnet/GENERATED_ARTIFACTS",
    "python3 scripts/validate_generated_configs.py --strict --path dogfood/live-runs/claude/01-op-stack-public-testnet/GENERATED_ARTIFACTS",
    "python3 scripts/check_bad_output_patterns.py --path dogfood/live-runs/claude/01-op-stack-public-testnet/GENERATED_ARTIFACTS --strict",
    "python3 plugins/evm-chain-engineering-pro/scripts/scan_secrets.py --path dogfood/live-runs/claude/01-op-stack-public-testnet/GENERATED_ARTIFACTS --strict --json"
  ],
  "validation_results": [
    {"command": "claude plugin validate", "exit_code": 0, "status": "pass"},
    {"command": "claude smoke run", "exit_code": 0, "status": "pass"},
    {"command": "validate_artifact_bundle", "exit_code": 0, "status": "pass"},
    {"command": "validate_generated_configs", "exit_code": 0, "status": "pass"},
    {"command": "check_bad_output_patterns", "exit_code": 0, "status": "pass"},
    {"command": "scan_secrets", "exit_code": 0, "status": "pass"}
  ],
  "policy_events": [
    {"type": "plugin-discovery", "status": "pass", "plugin_loaded": true, "plugin_skill_count": 14},
    {"type": "hook-lifecycle", "status": "pass", "hooks_observed": ["PreToolUse:Bash"]},
    {"type": "artifact-generation", "status": "pass"},
    {"type": "known-bad-output", "status": "pass", "findings": 0},
    {"type": "secret-scan", "status": "pass", "findings": 0}
  ],
  "manual_interventions": [
    "Replaced raw stream with redacted stream to keep committed evidence safety-scan clean.",
    "Applied scanner-context wording to generated docs and renderer defaults after known-bad checks flagged overly terse generated wording."
  ],
  "failures": [],
  "redactions": [
    "Full tool outputs and local paths were summarized or redacted.",
    "Thinking signatures were omitted."
  ],
  "notes": [
    "This package covers one strict smoke prompt only.",
    "Skill routing is observed-by-output/inferred rather than hidden platform telemetry.",
    "Strict v0.3 release remains blocked until the remaining required prompt matrix passes."
  ]
}
